{
  "name": "hello",
  "version": "0.1.0",
  "rootfs": "./rootfs",
  "entrypoint": ["/bin/sh"],
  "args": ["-c", "echo hello from capper && sleep 3600"],
  "workingDir": "/",
  "shell": "/bin/sh",
  "resources": {
    "memoryBytes": 67108864,
    "cpuTimeSecs": 60,
    "maxProcesses": 32,
    "fileSizeBytes": 4194304
  }
}
