{
  "name": "alpine",
  "version": "3.20.0",
  "rootfs": "./rootfs",
  "entrypoint": ["/sbin/capinit", "--", "/bin/bash"],
  "args": ["-lc", "echo hello from alpine && cat /etc/alpine-release && exec sleep 3600"],
  "env": {
    "PATH": "/usr/local/sbin:/usr/local/bin:/usr/sbin:/usr/bin:/sbin:/bin"
  },
  "workingDir": "/",
  "shell": "/bin/bash",
  "user": {
    "uid": 0,
    "gid": 0
  },
  "network": {
    "enabled": true
  },
  "resources": {
    "memoryBytes": 134217728,
    "cpuTimeSecs": 300,
    "maxProcesses": 128,
    "fileSizeBytes": 16777216
  }
}
